{
    "$schema": "../../schemas/scenario-pack.schema.json",
    "FormatVersion": 1,
    "ScenarioId": "scenario.watchtower",
    "DisplayName": "The Ruined Watchtower",
    "RulesetId": "ruleset.campaign",
    "StartingLocationId": "location.outpost",
    "Progress": {
        "InitialProgressId": "MissionNotAccepted",
        "ProgressIds": [
            "MissionNotAccepted",
            "MissionAccepted",
            "SignalActivated",
            "RaidersDefeated",
            "PartyDefeated"
        ],
        "Conclusions": [
            {
                "ProgressId": "PartyDefeated",
                "IsSuccess": false,
                "LocationId": "location.ruined-watchtower",
                "EpilogueText": "The raiders overrun what's left of the watchtower's defenses. The frontier outpost will need to send another party -- this one doesn't return."
            }
        ]
    },
    "PartyRequirement": {
        "MinimumMembers": 4,
        "MaximumMembers": 4,
        "MinimumConsciousMembers": 1
    },
    "Locations": [
        {
            "LocationId": "location.outpost",
            "DisplayName": "Frontier Outpost"
        },
        {
            "LocationId": "location.ruined-watchtower",
            "DisplayName": "Ruined Watchtower",
            "ExplorationMap": {
                "MapId": "map.ruined-watchtower",
                "Width": 6,
                "Height": 3,
                "StartingFloor": "GroundFloor",
                "StartingPosition": { "X": 1, "Y": 0 },
                "StartingFacing": "East",
                "Floors": [
                    {
                        "Floor": "GroundFloor",
                        "TraversablePositions": [
                            { "X": 1, "Y": 0 },
                            { "X": 2, "Y": 0 },
                            { "X": 3, "Y": 0 },
                            { "X": 0, "Y": 1 },
                            { "X": 1, "Y": 1 },
                            { "X": 2, "Y": 1 },
                            { "X": 3, "Y": 1 },
                            { "X": 4, "Y": 1 },
                            { "X": 1, "Y": 2 },
                            { "X": 2, "Y": 2 },
                            { "X": 3, "Y": 2 },
                            { "X": 4, "Y": 2 },
                            { "X": 5, "Y": 1 },
                            { "X": 5, "Y": 2 }
                        ],
                        "Stairs": [
                            {
                                "Position": { "X": 3, "Y": 0 },
                                "DestinationFloor": "UpperFloor",
                                "DestinationPosition": { "X": 3, "Y": 0 }
                            }
                        ],
                        "Doors": [
                            {
                                "DoorId": "door.watchtower.armory-door",
                                "Position": { "X": 3, "Y": 1 },
                                "Side": "East",
                                "IsSecret": false,
                                "IsLocked": false
                            },
                            {
                                "DoorId": "door.watchtower.hidden-vault",
                                "Position": { "X": 3, "Y": 2 },
                                "Side": "East",
                                "IsSecret": true,
                                "IsLocked": false
                            },
                            {
                                "DoorId": "door.watchtower.sealed-postern",
                                "Position": { "X": 1, "Y": 1 },
                                "Side": "West",
                                "IsSecret": false,
                                "IsLocked": true
                            }
                        ],
                        "Treasures": [
                            {
                                "TreasureId": "treasure.watchtower.armory-cache",
                                "Position": { "X": 5, "Y": 1 },
                                "GoldPieces": 25,
                                "ItemId": "item.arrow",
                                "Quantity": 10
                            }
                        ],
                        "Npcs": [
                            {
                                "NpcId": "npc.watchtower.bound-watchman",
                                "Position": { "X": 5, "Y": 0 },
                                "Name": "A Bound Watchman",
                                "DialogueText": "The raiders forced me to light the signal fires. I'm sorry -- I had no choice."
                            }
                        ]
                    },
                    {
                        "Floor": "UpperFloor",
                        "TraversablePositions": [
                            { "X": 1, "Y": 0 },
                            { "X": 2, "Y": 0 },
                            { "X": 3, "Y": 0 },
                            { "X": 1, "Y": 1 },
                            { "X": 2, "Y": 1 },
                            { "X": 3, "Y": 1 }
                        ],
                        "Stairs": [
                            {
                                "Position": { "X": 3, "Y": 0 },
                                "DestinationFloor": "GroundFloor",
                                "DestinationPosition": { "X": 3, "Y": 0 }
                            }
                        ]
                    }
                ]
            },
            "ExplorableProgressIds": [ "MissionAccepted", "RaidersDefeated" ]
        }
    ],
    "Routes": [
        {
            "RouteId": "route.outpost-watchtower",
            "OriginLocationId": "location.outpost",
            "DestinationLocationId": "location.ruined-watchtower",
            "FinalStepIndex": 3,
            "RequiredProgressIds": [ "MissionAccepted" ]
        }
    ],
    "Encounters": [
        {
            "EncounterId": "encounter.watchtower-signal-ambush",
            "BattlefieldId": "battlefield.watchtower-signal-chamber",
            "Width": 9,
            "Height": 8,
            "PartySideId": "side.party",
            "BlockedPositions": [],
            "PartyStartingPositions": [
                { "X": 1, "Y": 1 },
                { "X": 1, "Y": 2 },
                { "X": 0, "Y": 2 },
                { "X": 0, "Y": 1 }
            ],
            "Combatants": [
                {
                    "CombatantId": "combatant.watchtower-raider.melee",
                    "MonsterId": "monster.watchtower-raider.marauder",
                    "SideId": "side.watchtower-raiders",
                    "StartingPosition": { "X": 2, "Y": 1 }
                },
                {
                    "CombatantId": "combatant.watchtower-raider.ranged",
                    "MonsterId": "monster.watchtower-raider.archer",
                    "SideId": "side.watchtower-raiders",
                    "StartingPosition": { "X": 4, "Y": 2 }
                }
            ],
            "Outcome": {
                "VictoryProgressId": "RaidersDefeated",
                "DefeatProgressId": "PartyDefeated"
            }
        }
    ],
    "Triggers": [
        {
            "TriggerId": "trigger.watchtower-signal",
            "DisplayName": "Signal mechanism",
            "LocationId": "location.ruined-watchtower",
            "Floor": "UpperFloor",
            "Position": { "X": 2, "Y": 1 },
            "RequiredProgressIds": [ "MissionAccepted" ],
            "ResultingProgressId": "SignalActivated",
            "EncounterId": "encounter.watchtower-signal-ambush"
        }
    ],
    "Decisions": [
        {
            "DecisionId": "decision.watchtower-mission",
            "DisplayName": "Investigate the ruined watchtower",
            "LocationId": "location.outpost",
            "RequiredProgressIds": [ "MissionNotAccepted" ],
            "Options": [
                {
                    "OptionId": "AcceptMission",
                    "DisplayName": "Accept the commission",
                    "ResultingProgressId": "MissionAccepted"
                },
                {
                    "OptionId": "NotYet",
                    "DisplayName": "Not yet"
                }
            ]
        }
    ]
}
